Class names: ['buildings', 'forest', 'mountain', 'sea', 'street']
Number of classes: 5
Total images: 14063
Training set: 9843
Validation set: 2110
Test set: 2110

Class-wise distribution:
buildings: Train = 1840, Validation = 394, Test = 394
forest: Train = 1920, Validation = 412, Test = 411
mountain: Train = 2125, Validation = 456, Test = 456
sea: Train = 1940, Validation = 416, Test = 416
street: Train = 2018, Validation = 432, Test = 433


Total parameters: 16,560,709
Trainable parameters: 16,560,709


Starting training...

Epoch 1/50
------------------------------------------------------------
Training: 100%|██████████| 154/154 [01:09<00:00,  2.21it/s, loss=0.9545]
Train Loss: 0.8715 | Train Acc: 0.6403
Validation: 100%|██████████| 33/33 [00:08<00:00,  4.08it/s, loss=0.7006]
Val Loss: 0.6391 | Val Acc: 0.7166
✓ New best validation accuracy: 0.7166

Epoch 2/50
------------------------------------------------------------
Training: 100%|██████████| 154/154 [00:57<00:00,  2.70it/s, loss=0.6700]
Train Loss: 0.6257 | Train Acc: 0.7554
Validation: 100%|██████████| 33/33 [00:05<00:00,  6.14it/s, loss=0.4548]
Val Loss: 0.4433 | Val Acc: 0.8327
✓ New best validation accuracy: 0.8327

Epoch 3/50
------------------------------------------------------------
Training: 100%|██████████| 154/154 [00:57<00:00,  2.66it/s, loss=0.3375]
Train Loss: 0.5135 | Train Acc: 0.8063
Validation: 100%|██████████| 33/33 [00:04<00:00,  7.05it/s, loss=0.9416]
Val Loss: 1.0338 | Val Acc: 0.6678
Patience: 1/6

Epoch 4/50
------------------------------------------------------------
Training: 100%|██████████| 154/154 [00:59<00:00,  2.61it/s, loss=0.6807]
Train Loss: 0.4800 | Train Acc: 0.8238
Validation: 100%|██████████| 33/33 [00:04<00:00,  6.97it/s, loss=1.1394]
Val Loss: 1.2308 | Val Acc: 0.5919
Patience: 2/6

Epoch 5/50
------------------------------------------------------------
Training: 100%|██████████| 154/154 [00:58<00:00,  2.62it/s, loss=0.8357]
Train Loss: 0.4391 | Train Acc: 0.8380
Validation: 100%|██████████| 33/33 [00:04<00:00,  7.04it/s, loss=0.2814]
Val Loss: 0.3496 | Val Acc: 0.8735
✓ New best validation accuracy: 0.8735

Epoch 6/50
------------------------------------------------------------
Training: 100%|██████████| 154/154 [00:58<00:00,  2.61it/s, loss=0.4374]
Train Loss: 0.4084 | Train Acc: 0.8476
Validation: 100%|██████████| 33/33 [00:04<00:00,  7.14it/s, loss=0.3383]
Val Loss: 0.4004 | Val Acc: 0.8540
Patience: 1/6

Epoch 7/50
------------------------------------------------------------
Training: 100%|██████████| 154/154 [00:58<00:00,  2.62it/s, loss=0.3107]
Train Loss: 0.3853 | Train Acc: 0.8630
Validation: 100%|██████████| 33/33 [00:04<00:00,  7.04it/s, loss=0.2925]
Val Loss: 0.3056 | Val Acc: 0.8858
✓ New best validation accuracy: 0.8858

Epoch 8/50
------------------------------------------------------------
Training: 100%|██████████| 154/154 [00:59<00:00,  2.61it/s, loss=0.2150]
Train Loss: 0.3602 | Train Acc: 0.8728
Validation: 100%|██████████| 33/33 [00:04<00:00,  7.06it/s, loss=0.2820]
Val Loss: 0.2863 | Val Acc: 0.8976
✓ New best validation accuracy: 0.8976

Epoch 9/50
------------------------------------------------------------
Training: 100%|██████████| 154/154 [00:59<00:00,  2.57it/s, loss=0.3178]
Train Loss: 0.3576 | Train Acc: 0.8699
Validation: 100%|██████████| 33/33 [00:04<00:00,  6.67it/s, loss=0.3923]
Val Loss: 0.3937 | Val Acc: 0.8588
Patience: 1/6

Epoch 10/50
------------------------------------------------------------
Training: 100%|██████████| 154/154 [00:59<00:00,  2.59it/s, loss=0.3194]
Train Loss: 0.3325 | Train Acc: 0.8783
Validation: 100%|██████████| 33/33 [00:04<00:00,  7.00it/s, loss=0.2603]
Val Loss: 0.3065 | Val Acc: 0.8896
Patience: 2/6

Epoch 11/50
------------------------------------------------------------
Training: 100%|██████████| 154/154 [00:59<00:00,  2.59it/s, loss=0.2256]
Train Loss: 0.3156 | Train Acc: 0.8884
Validation: 100%|██████████| 33/33 [00:04<00:00,  6.93it/s, loss=0.7846]
Val Loss: 0.3809 | Val Acc: 0.8701
Patience: 3/6

Epoch 12/50
------------------------------------------------------------
Training: 100%|██████████| 154/154 [00:59<00:00,  2.58it/s, loss=0.1914]
Train Loss: 0.3001 | Train Acc: 0.8892
Validation: 100%|██████████| 33/33 [00:04<00:00,  7.00it/s, loss=0.3277]
Val Loss: 0.2668 | Val Acc: 0.9024
✓ New best validation accuracy: 0.9024

Epoch 13/50
------------------------------------------------------------
Training: 100%|██████████| 154/154 [00:59<00:00,  2.60it/s, loss=0.1666]
Train Loss: 0.3095 | Train Acc: 0.8873
Validation: 100%|██████████| 33/33 [00:04<00:00,  6.92it/s, loss=0.4368]
Val Loss: 0.3164 | Val Acc: 0.8791
Patience: 1/6

Epoch 14/50
------------------------------------------------------------
Training: 100%|██████████| 154/154 [00:59<00:00,  2.59it/s, loss=0.1915]
Train Loss: 0.2986 | Train Acc: 0.8926
Validation: 100%|██████████| 33/33 [00:04<00:00,  6.79it/s, loss=0.1869]
Val Loss: 0.2591 | Val Acc: 0.9081
✓ New best validation accuracy: 0.9081

Epoch 15/50
------------------------------------------------------------
Training: 100%|██████████| 154/154 [00:59<00:00,  2.59it/s, loss=0.2282]
Train Loss: 0.2842 | Train Acc: 0.8962
Validation: 100%|██████████| 33/33 [00:04<00:00,  6.96it/s, loss=0.3224]
Val Loss: 0.2208 | Val Acc: 0.9209
✓ New best validation accuracy: 0.9209

Epoch 16/50
------------------------------------------------------------
Training: 100%|██████████| 154/154 [00:59<00:00,  2.60it/s, loss=0.2120]
Train Loss: 0.2703 | Train Acc: 0.9014
Validation: 100%|██████████| 33/33 [00:04<00:00,  7.00it/s, loss=0.3377]
Val Loss: 0.2206 | Val Acc: 0.9242
✓ New best validation accuracy: 0.9242

Epoch 17/50
------------------------------------------------------------
Training: 100%|██████████| 154/154 [00:58<00:00,  2.65it/s, loss=0.1726]
Train Loss: 0.2677 | Train Acc: 0.9063
Validation: 100%|██████████| 33/33 [00:05<00:00,  5.96it/s, loss=0.3838]
Val Loss: 0.2444 | Val Acc: 0.9171
Patience: 1/6

Epoch 18/50
------------------------------------------------------------
Training: 100%|██████████| 154/154 [00:58<00:00,  2.64it/s, loss=0.3080]
Train Loss: 0.2686 | Train Acc: 0.9044
Validation: 100%|██████████| 33/33 [00:05<00:00,  6.03it/s, loss=0.3355]
Val Loss: 0.3898 | Val Acc: 0.8706
Patience: 2/6

Epoch 19/50
------------------------------------------------------------
Training: 100%|██████████| 154/154 [00:58<00:00,  2.65it/s, loss=0.2195]
Train Loss: 0.2589 | Train Acc: 0.9066
Validation: 100%|██████████| 33/33 [00:04<00:00,  6.89it/s, loss=0.4464]
Val Loss: 0.2570 | Val Acc: 0.9047
Patience: 3/6

Epoch 20/50
------------------------------------------------------------
Training: 100%|██████████| 154/154 [00:58<00:00,  2.61it/s, loss=0.3305]
Train Loss: 0.2542 | Train Acc: 0.9082
Validation: 100%|██████████| 33/33 [00:04<00:00,  7.01it/s, loss=0.3340]
Val Loss: 0.2123 | Val Acc: 0.9251
✓ New best validation accuracy: 0.9251

Epoch 21/50
------------------------------------------------------------
Training: 100%|██████████| 154/154 [00:59<00:00,  2.61it/s, loss=0.2048]
Train Loss: 0.2491 | Train Acc: 0.9060
Validation: 100%|██████████| 33/33 [00:04<00:00,  7.10it/s, loss=0.6149]
Val Loss: 0.2674 | Val Acc: 0.9095
Patience: 1/6

Epoch 22/50
------------------------------------------------------------
Training: 100%|██████████| 154/154 [00:59<00:00,  2.61it/s, loss=0.3195]
Train Loss: 0.2295 | Train Acc: 0.9173
Validation: 100%|██████████| 33/33 [00:04<00:00,  7.06it/s, loss=0.1883]
Val Loss: 0.1918 | Val Acc: 0.9308
✓ New best validation accuracy: 0.9308

Epoch 23/50
------------------------------------------------------------
Training: 100%|██████████| 154/154 [00:59<00:00,  2.61it/s, loss=0.1669]
Train Loss: 0.2239 | Train Acc: 0.9205
Validation: 100%|██████████| 33/33 [00:04<00:00,  6.99it/s, loss=0.2142]
Val Loss: 0.2095 | Val Acc: 0.9242
Patience: 1/6

Epoch 24/50
------------------------------------------------------------
Training: 100%|██████████| 154/154 [00:59<00:00,  2.61it/s, loss=0.0913]
Train Loss: 0.2301 | Train Acc: 0.9199
Validation: 100%|██████████| 33/33 [00:04<00:00,  7.12it/s, loss=0.3872]
Val Loss: 0.1981 | Val Acc: 0.9313
✓ New best validation accuracy: 0.9313

Epoch 25/50
------------------------------------------------------------
Training: 100%|██████████| 154/154 [00:58<00:00,  2.61it/s, loss=0.1951]
Train Loss: 0.2169 | Train Acc: 0.9213
Validation: 100%|██████████| 33/33 [00:04<00:00,  7.07it/s, loss=0.3077]
Val Loss: 0.2545 | Val Acc: 0.9095
Patience: 1/6

Epoch 26/50
------------------------------------------------------------
Training: 100%|██████████| 154/154 [00:59<00:00,  2.61it/s, loss=0.1957]
Train Loss: 0.2133 | Train Acc: 0.9246
Validation: 100%|██████████| 33/33 [00:04<00:00,  7.02it/s, loss=0.3839]
Val Loss: 0.1998 | Val Acc: 0.9265
Patience: 2/6

Epoch 27/50
------------------------------------------------------------
Training: 100%|██████████| 154/154 [00:58<00:00,  2.61it/s, loss=0.1847]
Train Loss: 0.1766 | Train Acc: 0.9364
Validation: 100%|██████████| 33/33 [00:04<00:00,  7.04it/s, loss=0.2443]
Val Loss: 0.1517 | Val Acc: 0.9436
✓ New best validation accuracy: 0.9436

Epoch 28/50
------------------------------------------------------------
Training: 100%|██████████| 154/154 [00:59<00:00,  2.61it/s, loss=0.2037]
Train Loss: 0.1565 | Train Acc: 0.9443
Validation: 100%|██████████| 33/33 [00:04<00:00,  7.13it/s, loss=0.2747]
Val Loss: 0.1610 | Val Acc: 0.9365
Patience: 1/6

Epoch 29/50
------------------------------------------------------------
Training: 100%|██████████| 154/154 [00:59<00:00,  2.59it/s, loss=0.1192]
Train Loss: 0.1498 | Train Acc: 0.9473
Validation: 100%|██████████| 33/33 [00:04<00:00,  7.06it/s, loss=0.2638]
Val Loss: 0.1510 | Val Acc: 0.9441
✓ New best validation accuracy: 0.9441

Epoch 30/50
------------------------------------------------------------
Training: 100%|██████████| 154/154 [00:59<00:00,  2.61it/s, loss=0.2453]
Train Loss: 0.1531 | Train Acc: 0.9454
Validation: 100%|██████████| 33/33 [00:04<00:00,  6.95it/s, loss=0.2735]
Val Loss: 0.1527 | Val Acc: 0.9445
✓ New best validation accuracy: 0.9445

Epoch 31/50
------------------------------------------------------------
Training: 100%|██████████| 154/154 [00:58<00:00,  2.65it/s, loss=0.2515]
Train Loss: 0.1480 | Train Acc: 0.9479
Validation: 100%|██████████| 33/33 [00:05<00:00,  6.10it/s, loss=0.2753]
Val Loss: 0.1649 | Val Acc: 0.9379
Patience: 1/6

Epoch 32/50
------------------------------------------------------------
Training: 100%|██████████| 154/154 [00:58<00:00,  2.65it/s, loss=0.1130]
Train Loss: 0.1474 | Train Acc: 0.9481
Validation: 100%|██████████| 33/33 [00:05<00:00,  5.99it/s, loss=0.2312]
Val Loss: 0.1559 | Val Acc: 0.9408
Patience: 2/6

Epoch 33/50
------------------------------------------------------------
Training: 100%|██████████| 154/154 [00:58<00:00,  2.64it/s, loss=0.1158]
Train Loss: 0.1436 | Train Acc: 0.9526
Validation: 100%|██████████| 33/33 [00:04<00:00,  7.08it/s, loss=0.2216]
Val Loss: 0.1551 | Val Acc: 0.9441
Patience: 3/6

Epoch 34/50
------------------------------------------------------------
Training: 100%|██████████| 154/154 [00:59<00:00,  2.60it/s, loss=0.0432]
Train Loss: 0.1316 | Train Acc: 0.9528
Validation: 100%|██████████| 33/33 [00:04<00:00,  7.17it/s, loss=0.2177]
Val Loss: 0.1558 | Val Acc: 0.9427
Patience: 4/6

Epoch 35/50
------------------------------------------------------------
Training: 100%|██████████| 154/154 [00:59<00:00,  2.60it/s, loss=0.2486]
Train Loss: 0.1273 | Train Acc: 0.9556
Validation: 100%|██████████| 33/33 [00:04<00:00,  7.03it/s, loss=0.1890]
Val Loss: 0.1451 | Val Acc: 0.9479
✓ New best validation accuracy: 0.9479

Epoch 36/50
------------------------------------------------------------
Training: 100%|██████████| 154/154 [00:59<00:00,  2.59it/s, loss=0.0830]
Train Loss: 0.1310 | Train Acc: 0.9527
Validation: 100%|██████████| 33/33 [00:04<00:00,  6.98it/s, loss=0.2187]
Val Loss: 0.1513 | Val Acc: 0.9445
Patience: 1/6

Epoch 37/50
------------------------------------------------------------
Training: 100%|██████████| 154/154 [00:59<00:00,  2.58it/s, loss=0.1057]
Train Loss: 0.1324 | Train Acc: 0.9551
Validation: 100%|██████████| 33/33 [00:04<00:00,  7.29it/s, loss=0.2353]
Val Loss: 0.1525 | Val Acc: 0.9464
Patience: 2/6

Epoch 38/50
------------------------------------------------------------
Training: 100%|██████████| 154/154 [00:59<00:00,  2.59it/s, loss=0.1154]
Train Loss: 0.1317 | Train Acc: 0.9553
Validation: 100%|██████████| 33/33 [00:04<00:00,  7.29it/s, loss=0.2172]
Val Loss: 0.1482 | Val Acc: 0.9479
Patience: 3/6

Epoch 39/50
------------------------------------------------------------
Training: 100%|██████████| 154/154 [00:59<00:00,  2.59it/s, loss=0.2252]
Train Loss: 0.1326 | Train Acc: 0.9530
Validation: 100%|██████████| 33/33 [00:04<00:00,  7.04it/s, loss=0.2196]
Val Loss: 0.1510 | Val Acc: 0.9460
Patience: 4/6

Epoch 40/50
------------------------------------------------------------
Training: 100%|██████████| 154/154 [00:59<00:00,  2.59it/s, loss=0.1694]
Train Loss: 0.1262 | Train Acc: 0.9553
Validation: 100%|██████████| 33/33 [00:04<00:00,  7.04it/s, loss=0.2410]
Val Loss: 0.1524 | Val Acc: 0.9460
Patience: 5/6

Epoch 41/50
------------------------------------------------------------
Training: 100%|██████████| 154/154 [00:59<00:00,  2.60it/s, loss=0.1366]
Train Loss: 0.1325 | Train Acc: 0.9554
Validation: 100%|██████████| 33/33 [00:04<00:00,  7.18it/s, loss=0.2076]
Val Loss: 0.1474 | Val Acc: 0.9483
✓ New best validation accuracy: 0.9483

Epoch 42/50
------------------------------------------------------------
Training: 100%|██████████| 154/154 [00:59<00:00,  2.59it/s, loss=0.1176]
Train Loss: 0.1273 | Train Acc: 0.9545
Validation: 100%|██████████| 33/33 [00:04<00:00,  7.12it/s, loss=0.2166]
Val Loss: 0.1481 | Val Acc: 0.9483
Patience: 1/6

Epoch 43/50
------------------------------------------------------------
Training: 100%|██████████| 154/154 [00:59<00:00,  2.61it/s, loss=0.3098]
Train Loss: 0.1337 | Train Acc: 0.9509
Validation: 100%|██████████| 33/33 [00:04<00:00,  6.99it/s, loss=0.1934]
Val Loss: 0.1434 | Val Acc: 0.9493
✓ New best validation accuracy: 0.9493

Epoch 44/50
------------------------------------------------------------
Training: 100%|██████████| 154/154 [00:59<00:00,  2.59it/s, loss=0.0716]
Train Loss: 0.1285 | Train Acc: 0.9547
Validation: 100%|██████████| 33/33 [00:04<00:00,  6.92it/s, loss=0.1840]
Val Loss: 0.1444 | Val Acc: 0.9483
Patience: 1/6

Epoch 45/50
------------------------------------------------------------
Training: 100%|██████████| 154/154 [00:59<00:00,  2.59it/s, loss=0.1197]
Train Loss: 0.1260 | Train Acc: 0.9558
Validation: 100%|██████████| 33/33 [00:04<00:00,  7.07it/s, loss=0.2066]
Val Loss: 0.1464 | Val Acc: 0.9488
Patience: 2/6

Epoch 46/50
------------------------------------------------------------
Training: 100%|██████████| 154/154 [00:58<00:00,  2.64it/s, loss=0.0858]
Train Loss: 0.1309 | Train Acc: 0.9546
Validation: 100%|██████████| 33/33 [00:05<00:00,  5.92it/s, loss=0.2032]
Val Loss: 0.1468 | Val Acc: 0.9502
✓ New best validation accuracy: 0.9502

Epoch 47/50
------------------------------------------------------------
Training: 100%|██████████| 154/154 [00:58<00:00,  2.64it/s, loss=0.0520]
Train Loss: 0.1303 | Train Acc: 0.9550
Validation: 100%|██████████| 33/33 [00:05<00:00,  5.89it/s, loss=0.1873]
Val Loss: 0.1419 | Val Acc: 0.9488
Patience: 1/6

Epoch 48/50
------------------------------------------------------------
Training: 100%|██████████| 154/154 [00:58<00:00,  2.63it/s, loss=0.0838]
Train Loss: 0.1334 | Train Acc: 0.9508
Validation: 100%|██████████| 33/33 [00:04<00:00,  7.01it/s, loss=0.2537]
Val Loss: 0.1531 | Val Acc: 0.9431
Patience: 2/6

Epoch 49/50
------------------------------------------------------------
Training: 100%|██████████| 154/154 [00:59<00:00,  2.59it/s, loss=0.2075]
Train Loss: 0.1262 | Train Acc: 0.9557
Validation: 100%|██████████| 33/33 [00:04<00:00,  6.88it/s, loss=0.2162]
Val Loss: 0.1456 | Val Acc: 0.9493
Patience: 3/6

Epoch 50/50
------------------------------------------------------------
Training: 100%|██████████| 154/154 [00:59<00:00,  2.61it/s, loss=0.1221]
Train Loss: 0.1255 | Train Acc: 0.9559
Validation: 100%|██████████| 33/33 [00:04<00:00,  6.98it/s, loss=0.2181]Val Loss: 0.1478 | Val Acc: 0.9488
Patience: 4/6

Training history saved to 'training_history1.csv'

============================================================
FINAL EVALUATION ON VALIDATION SET
============================================================
Testing: 100%|██████████| 33/33 [00:07<00:00,  4.27it/s]
Test Accuracy: 0.9512 (95.12%)

Classification Report:
              precision    recall  f1-score   support

   buildings       0.91      0.92      0.91       394
      forest       1.00      0.98      0.99       411
    mountain       0.94      0.98      0.96       456
         sea       0.98      0.94      0.96       416
      street       0.94      0.93      0.93       433

    accuracy                           0.95      2110
   macro avg       0.95      0.95      0.95      2110
weighted avg       0.95      0.95      0.95      2110


